<?xml version="1.0" encoding="UTF-8"?>
<xs:schema xmlns:xs="http://www.w3.org/2001/XMLSchema"
           targetNamespace="http://schemas.gov.sk/form/esmao.eforms.bratislava.obec_024/201501.2"
           xmlns="http://schemas.gov.sk/form/esmao.eforms.bratislava.obec_024/201501.2"
           elementFormDefault="qualified">

  <xs:element name="E-form">
    <xs:complexType>
      <xs:sequence>
        <xs:element name="Meta" type="MetaType"/>
        <xs:element name="Body" type="BodyType"/>
      </xs:sequence>
    </xs:complexType>
  </xs:element>

  <xs:complexType name="MetaType">
    <xs:sequence>
      <xs:element name="ID" type="xs:string"/>
      <xs:element name="Name" type="xs:string"/>
      <xs:element name="Gestor" type="xs:string"/>
      <xs:element name="RecipientId" type="xs:string"/>
      <xs:element name="Version" type="xs:string"/>
      <xs:element name="ZepRequired" type="xs:boolean"/>
      <xs:element name="EformUuid" type="xs:string"/>
      <xs:element name="SenderID" type="xs:string"/>
    </xs:sequence>
  </xs:complexType>

  <xs:complexType name="BodyType">
    <xs:sequence>
      <xs:element name="Json" type="xs:string"/>
      <xs:element name="Summary" type="SummaryType"/>
      <xs:element name="TermsAndConditions" type="xs:string"/>
    </xs:sequence>
  </xs:complexType>

  <xs:complexType name="SummaryType">
    <xs:sequence>
      <xs:element name="Form" type="FormType"/>
    </xs:sequence>
  </xs:complexType>

  <xs:complexType name="FormType">
    <xs:sequence>
      <xs:element name="Step" type="StepType" minOccurs="0" maxOccurs="unbounded"/>
    </xs:sequence>
  </xs:complexType>

  <xs:complexType name="StepType">
    <xs:choice minOccurs="0" maxOccurs="unbounded">
      <xs:element name="Field" type="FieldType"/>
      <xs:element name="Array" type="ArrayType"/>
    </xs:choice>
    <xs:attribute name="id" type="xs:string" use="required"/>
    <xs:attribute name="title" type="xs:string" use="required"/>
  </xs:complexType>

  <xs:complexType name="ArrayType">
    <xs:sequence>
      <xs:element name="ArrayItem" type="ArrayItemType" minOccurs="0" maxOccurs="unbounded"/>
    </xs:sequence>
    <xs:attribute name="id" type="xs:string" use="required"/>
    <xs:attribute name="title" type="xs:string" use="required"/>
  </xs:complexType>

  <xs:complexType name="ArrayItemType">
    <xs:choice minOccurs="0" maxOccurs="unbounded">
      <xs:element name="Field" type="FieldType"/>
      <xs:element name="Array" type="ArrayType"/>
    </xs:choice>
    <xs:attribute name="id" type="xs:string" use="required"/>
    <xs:attribute name="title" type="xs:string" use="required"/>
  </xs:complexType>

  <xs:complexType name="FieldType">
    <xs:choice minOccurs="0" maxOccurs="unbounded">
      <xs:element name="StringValue" type="xs:string"/>
      <xs:element name="FileValue" type="FileValueType"/>
      <xs:element name="NoneValue">
        <xs:complexType/>
      </xs:element>
      <xs:element name="InvalidValue">
        <xs:complexType/>
      </xs:element>
    </xs:choice>
    <xs:attribute name="id" type="xs:string" use="required"/>
    <xs:attribute name="label" type="xs:string" use="required"/>
  </xs:complexType>

  <xs:complexType name="FileValueType">
    <xs:simpleContent>
      <xs:extension base="xs:string">
        <xs:attribute name="id" type="xs:string" use="required"/>
      </xs:extension>
    </xs:simpleContent>
  </xs:complexType>

</xs:schema>