<?xml version="1.0" encoding="UTF-8"?>
<E-form xmlns="http://schemas.gov.sk/form/esmao.eforms.bratislava.obec_024/201501.2" xsi:schemaLocation="http://schemas.gov.sk/form/esmao.eforms.bratislava.obec_024/201501.2 schema.xsd" xmlns:xsi="http://www.w3.org/2001/XMLSchema-instance">
  <Meta>
    <ID>esmao.eforms.bratislava.obec_024</ID>
    <Name>Priznanie k dani z nehnuteľností</Name>
    <Gestor>Martin Pinter</Gestor>
    <RecipientId/>
    <Version>201501.2</Version>
    <ZepRequired>0</ZepRequired>
    <EformUuid>string</EformUuid>
    <SenderID>mailto:</SenderID>
  </Meta>
  <Body>
    <Json>{"druhPriznania":{"rok":2024,"druh":"opravnePriznanie"},"udajeODanovnikovi":{"stat":"686","email":"test@test.com","obecPsc":{"psc":"83103","obec":"Bratislava"},"telefon":"+421948417711","priznanieAko":"fyzickaOsoba","voSvojomMene":true,"menoTitul":{"meno":"Lincoln","titul":"Mgr."},"priezvisko":"Abraham","rodneCislo":"9203146326","ulicaCisloFyzickaOsoba":{"cislo":"6","ulica":"Robotnícka"},"korespondencnaAdresa":{"korespondencnaAdresaRovnaka":false,"stat":"703","obecPsc":{"psc":"83106","obec":"Bratislava"},"ulicaCisloKorespondencnaAdresa":{"cislo":"7","ulica":"Prašivá"}}},"danZPozemkov":{"vyplnitObject":{"vyplnit":true},"kalkulackaWrapper":{"pouzitKalkulacku":true},"priznania":[{"pozemky":[{"datumy":{"datumVznikuDanovejPovinnosti":"2024-01-13","datumZanikuDanovejPovinnosti":"2024-01-04"},"kataster":"Devínska Nová Ves","druhPozemku":"B","celkovaVymeraPozemku":218,"cisloListuVlastnictva":"4589","spoluvlastnickyPodiel":"1/1","parcelneCisloSposobVyuzitiaPozemku":{"cisloParcely":"7986/1","sposobVyuzitiaPozemku":"Ložisko"},"podielPriestoruNaSpolocnychCastiachAZariadeniachDomu":"4587/53994"},{"datumy":{"datumVznikuDanovejPovinnosti":"2024-01-13","datumZanikuDanovejPovinnosti":"2024-01-04"},"kataster":"Devínska Nová Ves","druhPozemku":"B","celkovaVymeraPozemku":218,"cisloListuVlastnictva":"4589","spoluvlastnickyPodiel":"1/1","parcelneCisloSposobVyuzitiaPozemku":{"cisloParcely":"7986/1","sposobVyuzitiaPozemku":"Ložisko"},"podielPriestoruNaSpolocnychCastiachAZariadeniachDomu":"4587/53994"}],"pravnyVztah":"vlastnik","spoluvlastnictvo":"somJedinyVlastnik"}]},"danZoStaviebJedenUcel":{"vyplnitObject":{"vyplnit":true},"kalkulackaWrapper":{"pouzitKalkulacku":true},"priznania":[{"datumy":{"datumVznikuDanovejPovinnosti":"2024-01-04","datumZanikuDanovejPovinnosti":"2024-01-06"},"riadok1":{"supisneCislo":2526,"ulicaACisloDomu":"Príkladná 35"},"riadok2":{"kataster":"Jarovce","cisloParcely":"7859/1"},"pravnyVztah":"vlastnik","predmetDane":"a","spoluvlastnictvo":"podieloveSpoluvlastnictvo","cisloListuVlastnictva":"4597","spoluvlastnickyPodiel":"1/2","celkovaZastavanaPlocha":2659,"castStavbyOslobodenaOdDane":true,"pocetNadzemnychAPodzemnychPodlaziStavbyOkremPrvehoNadzemnehoPodlazia":5,"naZakladeDohody":true,"pocetSpoluvlastnikov":2,"splnomocnenie":[],"castStavbyOslobodenaOdDaneDetaily":{"celkovaVymeraPodlahovychPlochVsetkychPodlaziStavby":26,"vymeraPodlahovychPlochCastiStavbyOslobodenejOdDaneZoStavieb":89}}]},"danZoStaviebViacereUcely":{"vyplnitObject":{"vyplnit":true},"kalkulackaWrapper":{"pouzitKalkulacku":true},"priznania":[{"datumy":{"datumVznikuDanovejPovinnosti":"2024-01-05","datumZanikuDanovejPovinnosti":"2024-01-04"},"riadok1":{"supisneCislo":35,"ulicaACisloDomu":"Príkladná 35"},"riadok2":{"kataster":"Devín","cisloParcely":"5697/1"},"poznamka":"Príkladná 35","popisStavby":"Príkladná stavba","pravnyVztah":"najomca","celkovaVymera":25648,"nehnutelnosti":{"nehnutelnosti":[{"ucelVyuzitiaStavby":"b","spoluvlastnickyPodiel":"1/1","podielPriestoruNaSpolocnychCastiachAZariadeniachDomu":"4598/26594"}]},"spoluvlastnictvo":"bezpodieloveSpoluvlastnictvoManzelov","cisloListuVlastnictva":"4597","castStavbyOslobodenaOdDane":true,"pocetNadzemnychAPodzemnychPodlaziStavbyOkremPrvehoNadzemnehoPodlazia":4,"vymeraPodlahovychPlochCastiStavbyOslobodenejOdDaneZoStavieb":26}]},"danZBytovANebytovychPriestorov":{"vyplnitObject":{"vyplnit":true},"kalkulackaWrapper":{"pouzitKalkulacku":true},"priznania":[{"riadok1":{"supisneCislo":3694,"ulicaACisloDomu":"Príkladná 35"},"riadok2":{"kataster":"Karlova Ves","cisloParcely":"6975/2"},"poznamka":"Príkladná 35","pravnyVztah":"spravca","priznanieZaByt":{"priznanieZaByt":true,"datumy":{"datumVznikuDanovejPovinnosti":"2024-01-16","datumZanikuDanovejPovinnosti":"2024-01-07"},"cisloBytu":"3","popisBytu":"Dvojizbak","spoluvlastnickyPodiel":"1/1","vymeraPodlahovejPlochyNaIneUcely":18,"podielPriestoruNaSpolocnychCastiachAZariadeniachDomu":"2654/36594"},"spoluvlastnictvo":"podieloveSpoluvlastnictvo","cisloListuVlastnictva":"2648","priznanieZaNebytovyPriestor":{"priznanieZaNebytovyPriestor":true,"nebytovePriestory":[{"datumy":{"datumVznikuDanovejPovinnosti":"2024-01-05","datumZanikuDanovejPovinnosti":"2024-01-12"},"riadok":{"cisloNebytovehoPriestoruVBytovomDome":"G05","ucelVyuzitiaNebytovehoPriestoruVBytovomDome":"Garáž"},"spoluvlastnickyPodiel":"1/5","podielPriestoruNaSpolocnychCastiachAZariadeniachDomu":"2659/86569"}]},"naZakladeDohody":false,"pocetSpoluvlastnikov":3}]},"bezpodieloveSpoluvlastnictvoManzelov":{"email":"test@test.com","telefon":"+421948417711","menoTitul":{"meno":"Petra","titul":"Bsc"},"priezvisko":"Príkladná","rodneCislo":"920314/2634","rovnakaAdresa":false,"stat":"703","obecPsc":{"psc":"83106","obec":"Abelova"},"ulicaCisloBezpodieloveSpoluvlastnictvoManzelov":{"cislo":"25","ulica":"Príkladná 35"}},"znizenieAleboOslobodenieOdDane":{"byty":["option1","option2"],"stavby":["option1","option2","option3"],"pozemky":["option1","option2","option3","option4"],"poznamka":"Príkladná 35"}}</Json>
    <Summary>
      <Form>
        <Step id="root_druhPriznania" title="Druh priznania">
          <Field id="root_druhPriznania_druh" label="Vyberte druh priznania">
            <StringValue>Opravné priznanie</StringValue>
          </Field>
          <Field id="root_druhPriznania_rok" label="Za aký rok podávate priznanie?">
            <StringValue>2024</StringValue>
          </Field>
        </Step>
        <Step id="root_udajeODanovnikovi" title="Údaje o daňovníkovi">
          <Field id="root_udajeODanovnikovi_voSvojomMene" label="Podávate priznanie k dani z nehnuteľností vo svojom mene?">
            <StringValue>Áno</StringValue>
          </Field>
          <Field id="root_udajeODanovnikovi_priznanieAko" label="Podávate priznanie ako">
            <StringValue>Fyzická osoba</StringValue>
          </Field>
          <Field id="root_udajeODanovnikovi_rodneCislo" label="Rodné číslo">
            <StringValue>9203146326</StringValue>
          </Field>
          <Field id="root_udajeODanovnikovi_priezvisko" label="Priezvisko">
            <StringValue>Abraham</StringValue>
          </Field>
          <Field id="root_udajeODanovnikovi_menoTitul_meno" label="Meno">
            <StringValue>Lincoln</StringValue>
          </Field>
          <Field id="root_udajeODanovnikovi_menoTitul_titul" label="Titul">
            <StringValue>Mgr.</StringValue>
          </Field>
          <Field id="root_udajeODanovnikovi_ulicaCisloFyzickaOsoba_ulica" label="Ulica">
            <StringValue>Robotnícka</StringValue>
          </Field>
          <Field id="root_udajeODanovnikovi_ulicaCisloFyzickaOsoba_cislo" label="Čislo">
            <StringValue>6</StringValue>
          </Field>
          <Field id="root_udajeODanovnikovi_obecPsc_obec" label="Obec">
            <StringValue>Bratislava</StringValue>
          </Field>
          <Field id="root_udajeODanovnikovi_obecPsc_psc" label="PSČ">
            <StringValue>83103</StringValue>
          </Field>
          <Field id="root_udajeODanovnikovi_stat" label="Štát">
            <StringValue>Senegalská republika</StringValue>
          </Field>
          <Field id="root_udajeODanovnikovi_korespondencnaAdresa_korespondencnaAdresaRovnaka" label="Je korešpondenčná adresa rovnáká ako adresa trvalého pobytu?">
            <StringValue>Nie</StringValue>
          </Field>
          <Field id="root_udajeODanovnikovi_korespondencnaAdresa_ulicaCisloKorespondencnaAdresa_ulica" label="Ulica">
            <StringValue>Prašivá</StringValue>
          </Field>
          <Field id="root_udajeODanovnikovi_korespondencnaAdresa_ulicaCisloKorespondencnaAdresa_cislo" label="Čislo">
            <StringValue>7</StringValue>
          </Field>
          <Field id="root_udajeODanovnikovi_korespondencnaAdresa_obecPsc_obec" label="Obec">
            <StringValue>Bratislava</StringValue>
          </Field>
          <Field id="root_udajeODanovnikovi_korespondencnaAdresa_obecPsc_psc" label="PSČ">
            <StringValue>83106</StringValue>
          </Field>
          <Field id="root_udajeODanovnikovi_korespondencnaAdresa_stat" label="Štát">
            <StringValue>Slovenská republika</StringValue>
          </Field>
          <Field id="root_udajeODanovnikovi_email" label="E-mail">
            <StringValue>test@test.com</StringValue>
          </Field>
          <Field id="root_udajeODanovnikovi_telefon" label="Telefónne číslo">
            <StringValue>+421948417711</StringValue>
          </Field>
        </Step>
        <Step id="root_danZPozemkov" title="Priznanie k dani z pozemkov">
          <Field id="root_danZPozemkov_vyplnitObject_vyplnit" label="Chcete podať daňové priznanie k dani z pozemkov?">
            <StringValue>Áno</StringValue>
          </Field>
          <Field id="root_danZPozemkov_kalkulackaWrapper_pouzitKalkulacku" label="Kalkulačka výpočtu výmery pozemkov">
            <StringValue>Chcem pomôcť s výpočtom a použiť kalkulačku výpočtu výmery pozemkov</StringValue>
          </Field>
          <Array id="root_danZPozemkov_priznania" title="Priznania k dani z pozemkov">
            <ArrayItem id="root_danZPozemkov_priznania_0" title="Priznanie k dani z pozemkov č. 1">
              <Field id="root_danZPozemkov_priznania_0_pravnyVztah" label="Právny vzťah">
                <StringValue>Vlastník</StringValue>
              </Field>